{
  "schema_version": "1.0.0",
  "artifact_kind": "M02_PROBE_CONTROL_ACK_FUNCTION_DESIGN",
  "artifact_status": "CANDIDATE_BOUND_STATIC_DESIGN_GAPS_ALLOCATED_IN_V2_PREVIEW_EXECUTION_BLOCKED",
  "candidate": {
    "commit": "f6072c4540b6198677b345e3df4bf876df5c7410",
    "source_blob_sha256": {
      "proto/traffic/v1/ingest.proto": "c22c0b3cca0d254abeae81018c66817d9edd8dbfd6534a0f0a2e6802efbecd17",
      "go/control-plane/internal/alert/api/handler_probe_ack.go": "87605b980075b8a089ef3a6dc073f1a4f78d1b4cdc88d56b7f74ad4a56730794",
      "go/control-plane/internal/alert/api/handler_probe_ops.go": "732de88896289eb8367835b20da2ef8255c0f85b115cf8ba983c6c84c7623faa",
      "go/control-plane/internal/alert/api/handler_probe_outbox.go": "731d5594cb001368fd977ac577c5cf23380d4ea46c1fc0e838bcf5f2a10779b3",
      "go/control-plane/internal/alert/api/probe_operation_projection.go": "0cdf52786dcf2629f218881e5d55fef68e7bc346596f8168466cc4b949dd5ea9",
      "go/control-plane/internal/alert/consumer/probe_ack_consumer.go": "1c1762ce3b35d189c7312ffc04ad4ae0932a5402c92fcaea5feb075ef1d9ef4e",
      "go/control-plane/internal/alert/consumer/probe_operation_event_consumer.go": "3b0663fa856ba6e1a66827464f504ac8b8d4386a6dc5d780df6cf6af46e86c77",
      "go/control-plane/internal/ingest/control/bridge.go": "267c4b20a2560ec64092771aa32c3a05523f7af21cd22ccb1ca9296504c68491",
      "go/control-plane/internal/ingest/server/handler.go": "4f7d6edb8d25598e10419fc180d92d5a7abb5a9fad3a5f2fdf890dcc16baebdc",
      "go/control-plane/internal/common/kafka/producer.go": "c320d658068d959d950b42eabaf4c08b59d3a63beef744753348b93c45e64ad5",
      "go/control-plane/internal/common/kafka/consumer.go": "1920a276843b339a240b73b8f078646d8b64d62ab14e0ce69aaaa84afd9eaff1",
      "go/control-plane/cmd/alert-service/main.go": "3ab63bce22d2dcbd6ec5130b922c97800a4a88b0a51bbdd90431d96b3e22e025",
      "go/control-plane/cmd/ingest-gateway/main.go": "0558e30f07e5280c42927f830d76d767e87c43919c3e0ca93f1d9cb914ec5d1b",
      "rust/probe-agent/probe-agent/src/control.rs": "4a0cc16695d4502286c7beb9e7b6dc7d59f0a986e13b79f37888d134e6afa383"
    }
  },
  "preview_catalog_ref": {"path": "contracts/alignment/m02-code-direct-leaf-catalog.v1.json", "sha256": "29b7584696440bb70a8203f4ecbe4ae6574f1a785743562b94e87efbde73a703"},
  "append_only_resolution": {"path":"contracts/alignment/m02-code-direct-leaf-allocation.v2.json","revision_id":"M02-CODE-DIRECT-V2","allocation_epoch":"T1-M02-P308-P506","status":"ALLOCATED_V2_PREVIEW_NOT_IMPLEMENTED"},
  "leaf_bindings": [
    {"leaf_id":"M02-N012-L01","atomic_pr_id":"T1-M02-P250-CTR-n012-l01","role":"COMMAND_CONTRACT","locator":"proto/traffic/v1/ingest.proto#traffic.v1.ProbeOperationCommand"},
    {"leaf_id":"M02-N012-L02","atomic_pr_id":"T1-M02-P251-CTR-n012-l02","role":"ACK_CONTRACT","locator":"proto/traffic/v1/ingest.proto#traffic.v1.ProbeOperationAck"},
    {"leaf_id":"M02-N012-L03","atomic_pr_id":"T1-M02-P252-CTR-n012-l03","role":"HEARTBEAT_ACK_INPUT","locator":"proto/traffic/v1/ingest.proto#traffic.v1.HeartbeatRequest"},
    {"leaf_id":"M02-N012-L04","atomic_pr_id":"T1-M02-P253-CTR-n012-l04","role":"HEARTBEAT_ACCEPTANCE_OUTPUT","locator":"proto/traffic/v1/ingest.proto#traffic.v1.HeartbeatResponse"},
    {"leaf_id":"M02-N012-L05","atomic_pr_id":"T1-M02-P254-WRT-n012-l05","role":"POSTGRES_ACK_AUTHORITY","locator":"go/control-plane/internal/alert/api/handler_probe_ack.go#SystemHandler.applyProbeOperationAck"},
    {"leaf_id":"M02-N012-L06","atomic_pr_id":"T1-M02-P255-PRJ-n012-l06","role":"ACK_CONSUMER","locator":"go/control-plane/internal/alert/consumer/probe_ack_consumer.go#ProbeAckConsumer.handle"},
    {"leaf_id":"M02-N012-L07","atomic_pr_id":"T1-M02-P256-PRJ-n012-l07","role":"LIFECYCLE_CONSUMER","locator":"go/control-plane/internal/alert/consumer/probe_operation_event_consumer.go#ProbeOperationEventConsumer.handle"},
    {"leaf_id":"M02-N012-L08","atomic_pr_id":"T1-M02-P257-PRJ-n012-l08","role":"COMMAND_ROUTER","locator":"go/control-plane/internal/ingest/control/bridge.go#Router.Route"},
    {"leaf_id":"M02-N012-L09","atomic_pr_id":"T1-M02-P258-WRT-n012-l09","role":"HEARTBEAT_EXCHANGE","locator":"go/control-plane/internal/ingest/server/handler.go#IngestHandler.Heartbeat"},
    {"leaf_id":"M02-N012-L10","atomic_pr_id":"T1-M02-P259-WRT-n012-l10","role":"AGENT_EXECUTION","locator":"rust/probe-agent/probe-agent/src/control.rs#ProbeControlProcessor::process"},
    {"leaf_id":"M02-N012-L11","atomic_pr_id":"T1-M02-P260-WRT-n012-l11","role":"AGENT_ACK_REPLAY","locator":"rust/probe-agent/probe-agent/src/control.rs#ProbeControlProcessor::pending_acks"},
    {"leaf_id":"M02-N012-L12","atomic_pr_id":"T1-M02-P261-WRT-n012-l12","role":"CONFIG_EXECUTOR","locator":"rust/probe-agent/probe-agent/src/control/config_push.rs#ConfigPushExecutor::execute"},
    {"leaf_id":"M02-N012-L13","atomic_pr_id":"T1-M02-P262-WRT-n012-l13","role":"CERT_EXECUTOR","locator":"rust/probe-agent/probe-agent/src/control/cert_rotate.rs#CertRotateExecutor::execute"},
    {"leaf_id":"M02-N012-L14","atomic_pr_id":"T1-M02-P263-PRJ-n012-l14","role":"GATEWAY_ACK_BRIDGE","locator":"go/control-plane/internal/ingest/control/bridge.go#Bridge.Exchange"},
    {"leaf_id":"M02-N012-L15","atomic_pr_id":"T1-M02-P264-WRT-n012-l15","role":"DESIRED_OPERATION_AUTHORITY","locator":"go/control-plane/internal/alert/api/handler_probe_ops.go#SystemHandler.insertProbeOperation"},
    {"leaf_id":"M02-N012-L16","atomic_pr_id":"T1-M02-P265-WRT-n012-l16","role":"OUTBOX_DISPATCHER","locator":"go/control-plane/internal/alert/api/handler_probe_outbox.go#SystemHandler.drainProbeOperationOutbox"},
    {"leaf_id":"M02-N012-L17","atomic_pr_id":"T1-M02-P266-WRT-n012-l17","role":"ALERT_PIPELINE_FLAGS","locator":"go/control-plane/internal/alert/config/probe_operation_pipeline.go#ProbeOperationPipelineConfig"},
    {"leaf_id":"M02-N012-L18","atomic_pr_id":"T1-M02-P267-REF-n012-l18","role":"ALERT_STARTUP_ORDER","locator":"go/control-plane/cmd/alert-service/probe_operation_pipeline.go#initProbeOperationPipelines"},
    {"leaf_id":"M02-N012-L19","atomic_pr_id":"T1-M02-P268-WRT-n012-l19","role":"INGEST_PIPELINE_FLAGS","locator":"go/control-plane/internal/ingest/config/probe_control_pipeline.go#ProbeControlPipelineConfig"},
    {"leaf_id":"M02-N012-L20","atomic_pr_id":"T1-M02-P269-REF-n012-l20","role":"INGEST_STARTUP_ORDER","locator":"go/control-plane/cmd/ingest-gateway/probe_control_pipeline.go#initProbeControlPipeline"},
    {"leaf_id":"M02-N012-L21","atomic_pr_id":"T1-M02-P270-REF-n012-l21","role":"CONTRACT_MATRIX","locator":"go/control-plane/internal/ingest/server/m02_probe_control_contract_test.go#TestM02ProbeControlMatrix"},
    {"leaf_id":"M02-N012-L22","atomic_pr_id":"T1-M02-P271-TST-PRE-n012-l22","role":"PRE_EXECUTION_EVIDENCE","locator":"doc/02_acceptance/topic1/m02/n012/probe-control/test-result.json"},
    {"leaf_id":"M02-N012-L23","atomic_pr_id":"T1-M02-P272-IDX-n012-l23","role":"TASK_CLOSURE","locator":"doc/02_acceptance/topic1/tasks/t1-m02-n012/completion-candidate.json"}
  ],
  "append_only_leaf_bindings": [
    {"leaf_id":"M02-N012-L66","atomic_pr_id":"T1-M02-P450-WRT-n012-l66","role":"GROUP_LIFECYCLE_OBSERVER","locator":"go/control-plane/internal/common/kafka/generation_consumer.go#GenerationConsumer.SetGroupLifecycleObserver"},
    {"leaf_id":"M02-N012-L69","atomic_pr_id":"T1-M02-P456-WRT-n012-l69","role":"READINESS_PUBLISHER_WIRING","locator":"go/control-plane/cmd/ingest-gateway/probe_control_pipeline.go#wireProbeControlGroupLifecycle"},
    {"leaf_id":"M02-N012-L78","atomic_pr_id":"T1-M02-P465-WRT-n012-l78","role":"READINESS_GENERATION_ADAPTER","locator":"go/control-plane/internal/alert/consumer/probe_readiness_consumer.go#ProbeReadinessConsumer.StartGeneration"},
    {"leaf_id":"M02-N012-L90","atomic_pr_id":"T1-M02-P477-WRT-n012-l90","role":"GENERATION_CONSUMER_RUN","locator":"go/control-plane/internal/common/kafka/generation_consumer.go#GenerationConsumer.Run"},
    {"leaf_id":"M02-N012-L99","atomic_pr_id":"T1-M02-P486-WRT-n012-l99","role":"GENERATION_MESSAGE_PROCESSOR","locator":"go/control-plane/internal/common/kafka/generation_consumer.go#GenerationMessageProcessor.ProcessPartition"},
    {"leaf_id":"M02-N012-L102","atomic_pr_id":"T1-M02-P489-WRT-n012-l102","role":"ACK_GENERATION_ADAPTER","locator":"go/control-plane/internal/alert/consumer/probe_ack_consumer.go#ProbeAckConsumer.StartGeneration"},
    {"leaf_id":"M02-N012-L105","atomic_pr_id":"T1-M02-P492-WRT-n012-l105","role":"LIFECYCLE_GENERATION_ADAPTER","locator":"go/control-plane/internal/alert/consumer/probe_operation_event_consumer.go#ProbeOperationEventConsumer.StartGeneration"},
    {"leaf_id":"M02-N012-L108","atomic_pr_id":"T1-M02-P495-WRT-n012-l108","role":"COMMAND_GENERATION_ADAPTER","locator":"go/control-plane/internal/ingest/control/bridge.go#Router.StartGeneration"},
    {"leaf_id":"M02-N012-L111","atomic_pr_id":"T1-M02-P498-WRT-n012-l111","role":"READINESS_RENEWAL","locator":"go/control-plane/internal/ingest/control/readiness_publisher.go#ProbeControlReadinessPublisher.RunRenewal"},
    {"leaf_id":"M02-N012-L114","atomic_pr_id":"T1-M02-P501-WRT-n012-l114","role":"ALERT_GENERATION_CUTOVER","locator":"go/control-plane/cmd/alert-service/probe_operation_pipeline.go#startProbeAuthorityGenerationConsumers"},
    {"leaf_id":"M02-N012-L117","atomic_pr_id":"T1-M02-P504-WRT-n012-l117","role":"INGEST_GENERATION_CUTOVER","locator":"go/control-plane/cmd/ingest-gateway/probe_control_pipeline.go#startProbeCommandGenerationConsumer"}
  ],
  "current_static_findings": [